{
  "name": "test",
  "type": "Database",
  "subType": "MySQL-instance",
  "parentUuid": "eae13a37-e089-4272-930b-d057c72bdf45",
  "extendInfo": {
    "hostId": "eae13a37-e089-4272-930b-d057c72bdf45",
    "instancePort": "3306",
    "isTopInstance": "1"
  },
  "dependencies": {
    "agents": [
      {
        "uuid": "eae13a37-e089-4272-930b-d057c72bdf45"
      }
    ]
  },
  "auth": {
    "authType": "123",
    "authKey": 123,
    "authPwd": "sfgasgfasfgafg",
    "extendInfo": {
      "instancePort": 3306
    }
  }
}